{
  "$schema": "https://json-schema.org/draft/2020-12/schema",
  "$id": "forgeloop://schemas/verification-scope.schema.json",
  "title": "ForgeLoop verification scope",
  "type": "object",
  "required": ["schemaVersion", "protocolVersion", "taskId", "requestedMode", "resolvedMode", "verificationCycle", "changedPaths", "claimedPaths", "selectedPaths", "reasons", "fallback", "contractFingerprint", "repositoryFingerprint", "claimsFingerprint", "createdAt"],
  "additionalProperties": false,
  "properties": {
    "schemaVersion": { "const": 1 },
    "protocolVersion": { "const": 1 },
    "taskId": { "type": "string", "minLength": 1 },
    "requestedMode": { "enum": ["AUTO", "CHANGED", "CLAIMED", "FULL"] },
    "resolvedMode": { "enum": ["CHANGED", "CLAIMED", "FULL", "UNRESOLVED"] },
    "verificationCycle": { "type": "integer", "minimum": 1 },
    "changedPaths": { "type": "array", "items": { "type": "string" } },
    "claimedPaths": { "type": "array", "items": { "type": "string" } },
    "selectedPaths": { "type": "array", "items": { "type": "string" } },
    "reasons": { "type": "array", "items": { "type": "string", "minLength": 1 } },
    "fallback": { "oneOf": [{ "type": "null" }, { "type": "object" }] },
    "contractFingerprint": { "type": "string", "pattern": "^[a-f0-9]{64}$" },
    "repositoryFingerprint": { "type": "object" },
    "claimsFingerprint": { "type": "string", "pattern": "^[a-f0-9]{64}$" },
    "createdAt": { "type": "string", "minLength": 1 }
  }
}
